{
  "$schema": "https://json-schema.org/draft/2020-12/schema",
  "type": "object",
  "properties": {
    "slug": {
      "type": "string",
      "pattern": "^[a-z0-9]+(-[a-z0-9]+)*$"
    },
    "name": {
      "type": "string"
    },
    "ticker": {
      "anyOf": [
        {
          "type": "string"
        },
        {
          "type": "null"
        }
      ]
    },
    "logo": {
      "anyOf": [
        {
          "type": "string"
        },
        {
          "type": "null"
        }
      ]
    },
    "exposure": {
      "description": "a slug of registry/reference/vocabularies/asset-group.json",
      "type": "string",
      "pattern": "^[a-z0-9]+(-[a-z0-9]+)*$"
    },
    "identifiers": {
      "anyOf": [
        {
          "type": "array",
          "items": {
            "type": "object",
            "properties": {
              "scheme": {
                "type": "string",
                "enum": [
                  "isin",
                  "figi",
                  "lei"
                ]
              },
              "value": {
                "type": "string"
              }
            },
            "required": [
              "scheme",
              "value"
            ],
            "additionalProperties": false
          }
        },
        {
          "type": "null"
        }
      ]
    },
    "excludedReason": {
      "anyOf": [
        {
          "type": "string"
        },
        {
          "type": "null"
        }
      ]
    },
    "roles": {
      "type": "array",
      "items": {
        "type": "object",
        "properties": {
          "organization": {
            "type": "string",
            "minLength": 1
          },
          "kind": {
            "description": "a slug of registry/reference/vocabularies/role-kind.json",
            "type": "string",
            "pattern": "^[a-z0-9]+(-[a-z0-9]+)*$"
          },
          "from": {
            "anyOf": [
              {
                "type": "string",
                "format": "date",
                "pattern": "^(?:(?:\\d\\d[2468][048]|\\d\\d[13579][26]|\\d\\d0[48]|[02468][048]00|[13579][26]00)-02-29|\\d{4}-(?:(?:0[13578]|1[02])-(?:0[1-9]|[12]\\d|3[01])|(?:0[469]|11)-(?:0[1-9]|[12]\\d|30)|(?:02)-(?:0[1-9]|1\\d|2[0-8])))$"
              },
              {
                "type": "null"
              }
            ]
          },
          "to": {
            "anyOf": [
              {
                "type": "string",
                "format": "date",
                "pattern": "^(?:(?:\\d\\d[2468][048]|\\d\\d[13579][26]|\\d\\d0[48]|[02468][048]00|[13579][26]00)-02-29|\\d{4}-(?:(?:0[13578]|1[02])-(?:0[1-9]|[12]\\d|3[01])|(?:0[469]|11)-(?:0[1-9]|[12]\\d|30)|(?:02)-(?:0[1-9]|1\\d|2[0-8])))$"
              },
              {
                "type": "null"
              }
            ]
          },
          "sourceLinks": {
            "anyOf": [
              {
                "type": "array",
                "items": {
                  "type": "string"
                }
              },
              {
                "type": "null"
              }
            ]
          },
          "protocolIds": {
            "anyOf": [
              {
                "type": "array",
                "items": {
                  "anyOf": [
                    {
                      "type": "integer",
                      "minimum": -9007199254740991,
                      "maximum": 9007199254740991
                    },
                    {
                      "type": "string",
                      "pattern": "^parent#[a-z0-9-]+$"
                    }
                  ]
                }
              },
              {
                "type": "null"
              }
            ]
          }
        },
        "required": [
          "organization",
          "kind"
        ],
        "additionalProperties": false
      }
    },
    "events": {
      "type": "array",
      "items": {
        "type": "object",
        "properties": {
          "kind": {
            "description": "a slug of registry/reference/vocabularies/event-kind.json",
            "type": "string",
            "pattern": "^[a-z0-9]+(-[a-z0-9]+)*$"
          },
          "date": {
            "anyOf": [
              {
                "type": "string",
                "format": "date",
                "pattern": "^(?:(?:\\d\\d[2468][048]|\\d\\d[13579][26]|\\d\\d0[48]|[02468][048]00|[13579][26]00)-02-29|\\d{4}-(?:(?:0[13578]|1[02])-(?:0[1-9]|[12]\\d|3[01])|(?:0[469]|11)-(?:0[1-9]|[12]\\d|30)|(?:02)-(?:0[1-9]|1\\d|2[0-8])))$"
              },
              {
                "type": "null"
              }
            ]
          },
          "successor": {
            "anyOf": [
              {
                "type": "object",
                "properties": {
                  "table": {
                    "type": "string",
                    "enum": [
                      "vocabulary",
                      "organization",
                      "underlying",
                      "venue",
                      "asset",
                      "deployment",
                      "perp_market",
                      "role",
                      "event",
                      "address_label",
                      "ack"
                    ]
                  },
                  "key": {
                    "type": "string"
                  }
                },
                "required": [
                  "table",
                  "key"
                ],
                "additionalProperties": false
              },
              {
                "type": "null"
              }
            ]
          },
          "outcome": {
            "anyOf": [
              {
                "type": "string",
                "enum": [
                  "suspicious",
                  "cleared"
                ]
              },
              {
                "type": "null"
              }
            ]
          },
          "reason": {
            "anyOf": [
              {
                "type": "string"
              },
              {
                "type": "null"
              }
            ]
          },
          "links": {
            "anyOf": [
              {
                "type": "array",
                "items": {
                  "type": "string"
                }
              },
              {
                "type": "null"
              }
            ]
          },
          "note": {
            "anyOf": [
              {
                "type": "string"
              },
              {
                "type": "null"
              }
            ]
          }
        },
        "required": [
          "kind"
        ],
        "additionalProperties": false
      }
    }
  },
  "required": [
    "slug",
    "name",
    "exposure"
  ],
  "additionalProperties": false
}
